<?xml version="1.0" encoding="UTF-8"?>
<!DOCTYPE IBCCustomer SYSTEM "dtd/IBCCustomer.dtd">
<IBCCustomer>
     <name>RR Donnelley Financial</name>
     <account>8147</account>
     <ref>89481</ref>
     <ref2 />
     <company />
     <address>55 Bishopsgate</address>
     <address2 />
     <city>London</city>
     <state />
     <zip>EC2N 3AS</zip>
     <country>England</country>
     <phone>+44 (0)20 7330 1500</phone>
</IBCCustomer>

